id,youtube_url,title,caption,synopsis,release_date,duration,language,country,thumbnail_url
SJUo1H1EkJI,https://www.youtube.com/watch?v=SJUo1H1EkJI,LIKE TURTLES,A mother is forced to raise her son in her car due to medical debt from losing her husband to cancer.,"After losing her husband to cancer and amassing a crippling amount of medical debt, Molly and her young son Ronnie are left to fend for themselves and have lost everything.
Molly struggles to get back on her feet as she tries to keep her son healthy on the streets even with an asthma condition and find a job after a decade as a stay-at-home mom. She also tries to instill a sense of security and stability for her son, shielding him from the difficulty of their life. But when Ronnie's asthma flares up, Molly must face the precariousness of her life, despite all of her attempts towards normality.",2021-03-03,1372.0,English,USA,assets/thumbnails/SJUo1H1EkJI.webp
smx86hHZk44,https://www.youtube.com/watch?v=smx86hHZk44,GAME NIGHT,"A young woman meets her boyfriend's parents during their regular game night. What begins as an innocent game, quickly changes into a nightmare.","Liz is meeting the parents of her new boyfriend Pepijn for the first time at their family night, where it becomes clear that his mother, Ingrid, dominates as matriarch.
Meeting in-laws is never easy to do, but for Liz it's complicated by the fact that Pepijn's family takes playing very, very seriously. And when Ingrid is determined to win at any cost, it makes for one very stressful night for Liz.",2018-11-02,890.0,English,USA,assets/thumbnails/smx86hHZk44.webp
4HJ1A2hA86A,https://www.youtube.com/watch?v=4HJ1A2hA86A,IT'S WHAT SHE WOULD HAVE WANTED,A group of friends destroy a dead friend's embarrassing secrets.,"Maggie welcomes a group of childhood friends back home after the unexpected death of Debra, one of their own. The long-time friends have not just converged for the funeral, but also to fulfill a childhood pact to destroy evidence of their friend's most embarrassing secrets.
So the group sneaks into Deb's childhood home and combs through her bedroom, unearthing incriminating objects and messages. But as they search, long-buried resentments bubble up between them -- including a few shocking secrets that might change how some of them feel about their friend.",2023-03-23,784.0,English,USA,assets/thumbnails/4HJ1A2hA86A.webp
IvfOdVYQ_NE,https://www.youtube.com/watch?v=IvfOdVYQ_NE,CHRISTMAS EVE EVE,"A woman goes home for the holidays, where she's forced to confront an unresolved family trauma.","Morgan is headed home to Kentucky for the holidays after a long while. Her parents are divorced, but she reconnects with both -- first with her mother Beverly and her new partner Jeff, who are packing up Morgan's old family home and moving to a new place.
On the way to one of her father Phil's family traditions -- a Christmas Eve Eve party -- she stops by his place. Phil lives alone, which worries his family because many of Phil's family have committed suicide around the holidays. Morgan finds her father embittered and angry, and they get into a fight -- one that forces them to confront her father's deep grief and sadness around the holidays.",2021-12-23,832.0,English,USA,assets/thumbnails/IvfOdVYQ_NE.webp
XLhGaEGVex0,https://www.youtube.com/watch?v=XLhGaEGVex0,RITUAL,"When a strict Christian family's daughter disappears from their remote farm, the local cop is disturbed by what he uncovers.","The Devlin family lives on a remote farm in Australia, left alone to live an existence based upon the most important thing in their lives: God.
But when their eldest daughter disappears, a local cop's arrival ruptures their carefully isolated world. His investigation unearths disturbing aspects of the family, but the truth is much darker than anyone imagines.",2020-01-24,908.0,English,USA,assets/thumbnails/XLhGaEGVex0.webp
DVlzqev8npM,https://www.youtube.com/watch?v=DVlzqev8npM,LORNE ft. Guy Pearce,"A wasteland traveler struggles with the weight of isolation. Then he's confronted by a mysterious stranger, who helps him realize his existential fears.","In an unspecified post-apocalyptic wasteland, a man named Lorne has set up his existence on the edge of a great wilderness, hiding out from what the world has become. When he encounters a stranger who stumbles upon his camp, the ensuing conversation reveals just how isolated Lorne is, and what the psychological costs of such isolation are.",2019-12-13,892.0,English,USA,assets/thumbnails/DVlzqev8npM.webp
TKGeXyYiLBo,https://www.youtube.com/watch?v=TKGeXyYiLBo,TWO DOSAS,"A geek takes his date to the most authentic Indian restaurant in the city. To his horror she goes off-menu, in Hindi.","Pavan -- a teacher in London who grew up in England -- takes fellow educator Chloe on a date. Pavan aims to impress ""English rose"" Chloe by taking her to the most authentic Indian restaurant in the city and eventually winning her over with a confident ""heart on the sleeve, sleeve in her face"" approach to romance.
But then Chloe upend Pavan's expectations, ordering an ""authentic"" Indian dish off-menu, demonstrating a rapport with the restaurant staff by speaking Hindi and eventually revealing to Pavan her past romance with another Indian man, who she backpacked with through India.
Pavan -- who ordered the somewhat cliched dosas at the restaurant -- becomes insecure, questioning his own authenticity as an Indian when faced with Chloe's obvious fluency with his supposedly ""native"" culture. As the night's misadventures continue, Pavan realizes he must either accept himself as he is, or spend the evening trying to keep up in a race he may not win.",2017-08-22,916.0,English,USA,assets/thumbnails/TKGeXyYiLBo.webp
rIwL3CCcLr4,https://www.youtube.com/watch?v=rIwL3CCcLr4,FRIGID,"Exhausted by her newborn, a first-time mother's home becomes a trap as her husband's sinister intentions emerge.","Leah, a young mother caring for her newborn at home. begins to chafe at the confines of her circumscribed life. Exhausted by the constant care of the baby and trapped in an increasingly claustrophobic house, she begins to question her husband Vincent's love and intentions as a more sinister side to him emerges.",2018-11-29,867.0,English,USA,assets/thumbnails/rIwL3CCcLr4.webp
hQ-XEhK7Or4,https://www.youtube.com/watch?v=hQ-XEhK7Or4,BALANCE,"Two climbers are connected by a rope. But one falls, leaving the other in an uneasy balance.","Henderson and Morris are friends scaling a mountain together, linked by a rope for safety. While crossing an easy passage, Henderson slips and falls. Morris quickly uses himself as a counterweight to keep from plunging to their deaths -- but both climbers find themselves hanging over a deep abyss with the balance between them unstable and perilous.
This action-adventure short -- which was a 2013 selection for the Academy Award for Best Live Action Short -- is nearly dialogue free, but there is still plenty of suspense and drama as the two climbers attempt to solve their dilemma.",2000-00-00,-1.0,English,USA,assets/thumbnails/hQ-XEhK7Or4.webp
1yXoxxrJzkQ,https://www.youtube.com/watch?v=1yXoxxrJzkQ,AT EASE,"Following an absence of three years, an on-leave Marine returns home to make amends with his ex-girlfriend on her wedding day.","Duncan is on leave from the Marines. He left his hometown three years ago, but only now has returned, just in time to face awkward questions from friends and family -- and make amends with his ex-girlfriend Kara on her wedding day.
But the meeting doesn't go quite as planned, leading Jacob and Kara on an unexpected path of reckoning.",2018-08-29,849.0,English,USA,assets/thumbnails/1yXoxxrJzkQ.webp
AiKCi5TLI9o,https://www.youtube.com/watch?v=AiKCi5TLI9o,O.I.,A man comes up with a truly original idea -- but sharing it has consequences.,"Chris is on a high: he just got engaged and has just made the biggest deal of his life. He wants to celebrate it by taking a trip down memory lane and revisits the bar where he made his first deal. But his ebullient mood is dragged down when he notices the other only customer there, Barry.
Barry's in a dark, depressed mood and Chris takes it upon himself to cheer Barry up and help solve his problems. But Barry's problem is a strange one: he has a truly original idea. But whenever he shares it... bad things happen. But Chris doesn't believe Barry and is determined to prove him wrong.",2021-06-24,1088.0,English,USA,assets/thumbnails/AiKCi5TLI9o.webp
nm6eTYg3xZs,https://www.youtube.com/watch?v=nm6eTYg3xZs,MADE PUBLIC,"On the eve of his wedding day, a groom's cold feet go viral, forcing him and his bride to rely on the court of public opinion to save-or destroy-their marriage.","It's the eve of Dave's wedding ceremony, and he's got doubts about tying the knot to his bride Sydney.
But when he makes his doubts public on social media, allowing his social network and beyond to weigh in on his dilemma, he's forced to confront his hesitations -- not to mention Sydney's Greek chorus of cynical bridesmaids and a very pissed-off Sydney herself -- in a pressure cooker of a situation. But has Dave's viral blunder derailed his marriage, or can he dig deep and save his relationship with Sydney?",2019-06-24,848.0,English,USA,assets/thumbnails/nm6eTYg3xZs.webp
HgA4DIfbhRs,https://www.youtube.com/watch?v=HgA4DIfbhRs,WEI-LAI,A Chinese American boy goes to his best friend's family -- and offers himself up for their adoption.,"Wei-Lai is the son of Chinese parents living in the U.S. But when he receives yet another spanking from his strict father, Wei-Lai decides to take matters into his own hands -- he flees to his best friend Luca's house, where he offers himself up for adoption. He's done with being Chinese and being his father's son.
But a child's whim turns into a more complex power play and identity crisis, as Wei-Lai disavows his Chinese heritage. He longs to be white, believing that white parents love their children more. But he comes to see that things, and love, aren't as simple as they seem.",2023-05-09,826.0,English,USA,assets/thumbnails/HgA4DIfbhRs.webp
deO_t3kOSFY,https://www.youtube.com/watch?v=deO_t3kOSFY,LAMBING SEASON,A young man uncovers a disturbing truth about himself.,"Joe, a young man growing up in the secluded North Yorkshire moors of England, discovers he might be the potential victim of a child kidnapping -- and his parents may not be who they seem.
This tense, disquieting short thriller may be only 17 minutes long, but with its taut pace and edgy tension, it packs an incredible amount of suspense and drama, luring viewers in with a mysterious premise and keeping them hooked as secrets unravel the deeper into the story they go.",2018-05-07,1063.0,English,USA,assets/thumbnails/deO_t3kOSFY.webp
nL91LegtUWk,https://www.youtube.com/watch?v=nL91LegtUWk,END-O,A woman wants to have sex. But her body sabotages her at the worst time.,"Jaq is accompanying her sister Claire to a hospital. Claire has endometriosis, a widespread but poorly understood tissue disorder that affects women's reproductive systems, causing immense pain, heavy bleeding and painful sex. Claire's condition is so painful that she needs to have her uterus removed, but she wants to keep her ovaries in hopes that she can have a biological child in some way in the future.
Jaq, too, has endometriosis, though it's not as advanced as Claire's yet. In some ways, Jaq is defiant about her endo and doesn't want to let it affect her life. She dates and has sex like any modern woman in London, but she hides her condition and refuses to talk much or even acknowledge it. But even Jaq can't escape the very messy reality of her condition, and her inability to talk openly about it sabotages a promising relationship and satisfying sex life. But when Claire's surgery takes a sad turn, Jaq realizes that she must learn to talk about it with openness.",2021-03-02,913.0,English,USA,assets/thumbnails/nL91LegtUWk.webp
mDvkux01G3A,https://www.youtube.com/watch?v=mDvkux01G3A,MINNOWS,A reclusive housekeeper meets a chatty fisherman -- and feels emotions she's never felt before.,"Meredith is a painfully shy, reclusive housekeeper, who doesn't have much of a life outside of her job or her home. She finds it hard to speak to others, feeling often self-conscious and awkward.
But one day after her bike is stolen, she meets Angelo, an affable, chatty fisherman who has emigrated to the U.S. from the Philippines. Angelo can talk enough for the both of them and even though they seem to have disparate temperaments, they forge an unlikely bond based on their common loneliness and a shared love of the ocean. He begins to pull Meredith out of her shell, but just as she begins to entertain more hopes and dreams for herself, she finds herself facing a challenge to those newly awakened emotions.",2023-06-16,2257.0,English,USA,assets/thumbnails/mDvkux01G3A.webp
QmVwCcUQRjU,https://www.youtube.com/watch?v=QmVwCcUQRjU,BRENTWOOD,A Star Trek actor tries to one-up his co-star in his return to Hollywood.,"Brent Spiner made his name as iconic android Data on ""Star Trek,"" but he's retreated from public life in Hollywood. He's been teaching acting at Cal State Fullerton, but when he's up for an award for his work on the show that made him famous, he mulls over a comeback, though he's reluctant to dive back in. It's a whole new Hollywood, complete with TMZ and hashtags, and Spiner isn't sure it's for him.
But when his old nemesis LeVar Burton commits to the awards show, Spiner decides to jump back into Hollywood. As he makes the rounds and re-enters in the industry, he finds himself embroiled in the old feud that plagued him during the height of his fame -- and it's still bitter enough to possibly derail his re-entry into Hollywood.",2020-11-09,739.0,English,USA,assets/thumbnails/QmVwCcUQRjU.webp
t0fSaPLsymI,https://www.youtube.com/watch?v=t0fSaPLsymI,WEEKEND WARRIORS,A fun-filled weekend in the Canadian part-time army comes to a halt when the camp receives an urgent distress call.,"Bobby Reddick is part of the Canadian army reserves, where as a part-time soldier, he never sees overseas duties. His small crew, led by tough-talking Guinness, are also reservists, who all have various reasons of joining, most of them having to do with money.
With his laidback attitude and his skepticism about violence, Bobby is at odds with his group, and he doesn't get a lot of respect from Officer Guinness, who embraces the military ethos wholeheartedly. But one weekend, the group receives an urgent distress call, and the ""weekend warriors"" are challenged to help protect Canada -- and confront the ultimate test of commitment.",2019-02-06,968.0,English,USA,assets/thumbnails/t0fSaPLsymI.webp
cIr5yEn4xGg,https://www.youtube.com/watch?v=cIr5yEn4xGg,THE SWEET SPOT,A little girl discovers a hidden resident at a daycare.,"Elizabeth and her mother are headed to an overnight childcare facility, a home run by Miss Linda. Elizabeth doesn't want to go, but her stressed-out, impatient mother has few options when she has to leave to attend a birth for her work.
The home is teeming with other kids, but Elizabeth is intrigued by the sound of a baby in the other room. But the baby is sick, according to Miss Linda, and needs to be separated from the other children. But Elizabeth's curiosity gets the better of her, as she finds herself drawn to the daycare's hidden resident and the secrets surrounding it.",2000-00-00,-1.0,English,USA,assets/thumbnails/cIr5yEn4xGg.webp
mlOh9kLhXD4,https://www.youtube.com/watch?v=mlOh9kLhXD4,I WAS STILL THERE WHEN YOU LEFT ME,A young girl believes she caused a fire in her building.,"Lila is a 7-year-old girl living in a residential tower block. Left to her own devices one night, with no parent around, she fends for herself, and even fries up some potatoes for dinner before falling asleep in front of the TV.
When she wakes up, the building is on fire. Her neighbor Karim helps her escape. But as she realizes what is happening and the blaze rages on, she believes she caused the fire and feels ashamed and guilty. She attaches herself to Karim, but as the night wears on and the intensity of the stress builds, Lila finds herself once again on her own.",2021-04-12,1370.0,English,USA,assets/thumbnails/mlOh9kLhXD4.webp
d3qf4GGNeFg,https://www.youtube.com/watch?v=d3qf4GGNeFg,BOYS AND TOYS,A woman hits on a younger guy at a bar. But it's awkward when she already knows him.,"Abby is out with her friend Olivia at a bar in New York. Both women are ogling men they aim to take home for the night, though Abby is difficult to please because most men there seem too young for the 30-something adjunct professor.
But when Olivia connects with someone at the bar, leaving Abby at loose ends, Abby decides to barrel forward with a young prospect named Tyler, who seems interested. But she has an unexpected connection to Tyler, leaving Abby to confront just how hard ""adulting"" can be.",2021-02-04,743.0,English,USA,assets/thumbnails/d3qf4GGNeFg.webp
3p7KPwNtxlI,https://www.youtube.com/watch?v=3p7KPwNtxlI,THE WILDS,A woman gets an urgent call from her estranged mother. Her troubled brother is back.,"Anna Wild is an artist and metal sculptor who has been somewhat estranged from her exasperating family. But one day, she receives an urgent phone call from her desperate-sounding mother, Helen. Anna’s troubled brother Graham has returned to the family home and there's an emergency related to his ""condition."" Helen needs Anna’s help with him right away -- and definitely before nightfall.
Reluctantly Anna returns to the family home, where she re-encounters many of the feelings, relationships and situations that drove her away in the first place. But the emergency will also remind her of her family's loyalty and love -- and how, sometimes, family may be the only people who understand.",2023-06-30,897.0,English,USA,assets/thumbnails/3p7KPwNtxlI.webp
jmzY3KAkhNc,https://www.youtube.com/watch?v=jmzY3KAkhNc,RED LIGHT,A man tries to convince a prostitute to run away with him. But all is not as it seems.,"Kelly works for Leon as a sex worker, where she receives customers in a room illuminated by the characteristic red light of their neighborhood. Leon occasionally treats Kelly nicely, buying her presents for her birthday, and he promises that their work arrangement is temporary, as they're saving up money for a brighter, better future.
But when her regular client Ben arrives for his usual appointment that week -- he pays, but he never has sex with her -- he has a proposition. He's moving, and he wants Kelly to run away with him. He promises her stability and safety, and an escape from an increasingly sordid life with Leon.",2021-12-08,706.0,English,USA,assets/thumbnails/jmzY3KAkhNc.webp
vgKDcvaIRZU,https://www.youtube.com/watch?v=vgKDcvaIRZU,BLACK SWELL,"A man perhaps to kill himself in a motel room, but struggles to do it with the racket of loud music coming from the room next door.","A man confined himself to a motel room out in Long Island on a desolate night full of tumultuous wind. Distraught and depressed, he settles into the room and takes out a gun, clearly intending to use it against himself.
But before he can do anything, loud heavy metal music plays in the neighboring room. Distracted and annoyed, he leaves his room to go next door and ask his neighbor to turn down the music, only to be recognized by the neighbor as Mr. Fennimore, his former teacher. The student, named Jordan, attempts to engage his erstwhile teacher in conversation, but is a reminder of the past enough to distract Mr. Fennimore from his grim purpose?",2019-06-03,523.0,English,USA,assets/thumbnails/vgKDcvaIRZU.webp
3-7IY1VNKuA,https://www.youtube.com/watch?v=3-7IY1VNKuA,GAME,A young boy struggles to accept the loss of his mother while his sister copes through violence.,"Jack is a young boy who is often isolated and alone. He struggles in the wake of his mother's death. He also is bullied by his sister, who subjects him to twisted games of surprisingly menace.
He struggles with the emptiness, tension and cruelty of his world, often taking refuge in the woods near his home and nursing the memories of his deceased mother. But after one game too many, eventually Jack asserts himself against his sister, leveling the same coiled threat against her that was used against him.",2019-09-16,839.0,English,USA,assets/thumbnails/3-7IY1VNKuA.webp
X5S2F1TLSvs,https://www.youtube.com/watch?v=X5S2F1TLSvs,STOP,A traffic stop turns sinister when two black men encounter a small-town cop on a power trip.,"Three people -- two Black men, and one white woman -- are traveling in a car at night. Glen is trying to get to his family in the midst of a medical emergency, and he's trying to travel as quickly as possible.
But when they're stopped on the way by a cop, things take an ominous turn as they're subjected to questions and demands undergirded by pernicious assumptions. As the passengers navigate the interrogation and police officer tightens his focus on the passengers, the situation escalates into a potential powder keg, threatening to detonate with just one small wrong move.",2019-11-07,696.0,English,USA,assets/thumbnails/X5S2F1TLSvs.webp
_FGJMU7-oNk,https://www.youtube.com/watch?v=_FGJMU7-oNk,MAKE IT HAPPEN,A determined athlete wrestles with his inner demons while faced with the opportunity of a lifetime.,"Akeem dreams of becoming a pro football player, which will help him free his mother from a life of poverty. He trains hard for his opportunity every day, pushing his body and mind as much as he can.
After months of training, he gets an invitation to a private team workout taking place in five days, where he can catch the eyes of the scouts and coaches who matter. The opportunity inspires Akeem, but it also gives rise to panic attacks. As the workout approaches, he continues to train relentlessly despite his fear -- but also edges closer to anxiety that may derail his hopes and dreams.",2021-09-09,1108.0,English,USA,assets/thumbnails/_FGJMU7-oNk.webp
uGAKa1PMe1w,https://www.youtube.com/watch?v=uGAKa1PMe1w,FOR YOU ft. Barry Keoghan,"A young girl struggles with an alcoholic mother and entering adulthood, until an act of devotion from her boyfriend offers relief and the strength to love.","Lana is a young Irish teen dealing with the difficulties of inner city Dublin and an alcoholic mother. But in the midst of it all, she's still a young woman coming of age and preparing to go to the Irish version of the prom -- the ""debs"" -- with her boyfriend Darren.
But when her preparations for the big event are in danger of derailment from her mother -- and her social anxieties about fitting in can't be allayed easily -- Lana's big night is almost ruined. But Darren offers her an act of devotion that offers her support and shelter, giving her the strength to give and receive love.",2019-04-30,748.0,English,USA,assets/thumbnails/uGAKa1PMe1w.webp
qvU6rjCOaVc,https://www.youtube.com/watch?v=qvU6rjCOaVc,THE BOOK OF RUTH,A grandmother reveals a secret after a family dinner.,"Ruth is getting a visit from her daughter and grandchildren, gathering together for Passover. It's a warm, loving celebration, full of food, conversation and family. But her granddaughter Lizzy has something she wants to discuss.
Lizzy knows something about her grandmother, something that could change the cultural fabric of the world. But when she tries to bring it up, Ruth wriggles out of the conversation -- until she realizes she can't fool her smart granddaughter anymore. What follows is the surfacing of a long-held family secret, a woman confronting the pain of her past and a meditation on what being our true selves really means.",2022-11-08,848.0,English,USA,assets/thumbnails/qvU6rjCOaVc.webp
gqCNnEeifkg,https://www.youtube.com/watch?v=gqCNnEeifkg,37 THINGS,A man has a brain condition that prevents him from knowing more than 37 things.,"Timothy Owen has a unique brain: he can only remember 37 things at a time. As a result, he often has a hard time recalling important things because they're often muscled out by useless data, and his life often feels tenuous and uncertain.
He fights to hold onto his most precious memory: that of a woman named Emily, whom he loved. But as the world gets denser with information, his hold onto Emily's memory is challenged.",2022-01-26,900.0,English,USA,assets/thumbnails/gqCNnEeifkg.webp
gCOBaDBnTAY,https://www.youtube.com/watch?v=gCOBaDBnTAY,LOST IN SOUND,"A woman, whose life has been accompanied by a cinematic score, struggles to connect with people.","A young woman -- played by actress Nora Zehetner -- constantly hears a movie score in her head, making her ordinary life seem cinematic and beautiful. But it also keeps her from connecting with other people as she drifts in and out of her own world. No one else can compete with the soundtrack in her mind.",2018-08-12,440.0,English,USA,assets/thumbnails/gCOBaDBnTAY.webp
