id,youtube_url,title,caption,synopsis,release_date,duration,language,country,thumbnail_url
Xg4j8u49V-g,https://www.youtube.com/watch?v=Xg4j8u49V-g,INBOX,A man who never leaves his home falls for his socially-anxious mailwoman.,"Tom is an agoraphobic man who lives through his phone, which lets him do his shopping and even ""date"" via apps... though he never can quite bring himself to leave the house to go on these dates. His agoraphobia is just too strong.
But when an attractive postal service delivery accidentally hits his ""package"" with the package she's tasked to deliver, they embark on a curious and odd exchange through his door's mail delivery slot. The postal worker has her own quirks and phobias, but somehow, the two manage to strike up a connection. But will Tom be able to follow through on this romantic spark?",2022-04-06,477.0,English,USA,assets/thumbnails/Xg4j8u49V-g.webp
XhgqNW-vXjQ,https://www.youtube.com/watch?v=XhgqNW-vXjQ,DOT,"A woman discovers her mother skipped her medication, then tries to track her down.","Trish is a harried young mother with a lot on her plate, preparing for her daughter's birthday party. But on that day, she discovers that her own mother Dot, tasked with making the cake, has been skipping her medications again.
Trying to track down the cake, Trish goes to her mother's house and discovers the space in disarray and her mother disoriented in the throes of an episode. In the confrontation, Trish's mother escapes into the neighborhood, bewildering the neighbors and forcing Trish to confront her unrealistic expectations about her mother and her ability to care for her.",2023-10-02,616.0,English,USA,assets/thumbnails/XhgqNW-vXjQ.webp
XjMi-Ldz820,https://www.youtube.com/watch?v=XjMi-Ldz820,OVER THE WALL,An Israeli boy and a Palestinian boy discover the truth isn't what they're told.,"Nathan is walking to school one day, making his way along the border wall between Israel and the Gaza Strip. Quite unexpectedly, a ball falls from the other side. He kicks it over, only to have it returned. He then meets another boy, Khaled, on the other side.
A friendship soon develops between the two, and they find ways to play and bond with one another, even with the wall between them. But as the realities of where they live come to the fore, their friendship may not quite survive.",2021-03-10,728.0,English,USA,assets/thumbnails/XjMi-Ldz820.webp
XvOF9P0CZHE,https://www.youtube.com/watch?v=XvOF9P0CZHE,AN ISLAND DRIFTS,A young teacher presses for the truth from a maladjusted student.,"Andrew is a young boy in elementary school in Singapore, and he has a crush on a classmate. While playing during recess on the playground one day, he accidentally knocks over his crush and falls on top of her.
Andrew’s teacher, Glen, is tasked with dealing with the incident, but when questioned, Andrew denies he did anything, getting a firm reprimand from Glen. Glen tells Andrew that the school will have to meet with his mother to discuss what happened. Andrew goes home before his mother arrives and ""deals"" with the problem himself, leading to a devastating chain of events that causes Glen to question everything.",2023-11-27,1113.0,English,USA,assets/thumbnails/XvOF9P0CZHE.webp
Y4KKquNL7vk,https://www.youtube.com/watch?v=Y4KKquNL7vk,MORNING JOY,A depressed man plays piano with a bird -- and rediscovers his zest for life.,"A depressed pianist is sitting at his instrument, trying to summon the energy and will to play and compose. Recently widowed, he can barely bring himself to do much of anything, much less play music.
But when a cheerful songbird lands in his window, the pianist tries to chase it out, but the intrepid creature refuses to leave. Resigned, the pianist lets it stay. Encouraged by the bird to play, the pianist finds himself engaged in an unexpected duet -- one that both returns his zest for music and consoles him in his grief.",2023-11-16,464.0,English,USA,assets/thumbnails/Y4KKquNL7vk.webp
YP1b_Sw62eQ,https://www.youtube.com/watch?v=YP1b_Sw62eQ,CRAZY HANDS,A man wakes up to discover his hands have a life of their own.,"Spencer wakes up one morning only to discover that his hands have taken on a life of their own -- they shake uncontrollably, disrupting all his everyday routines.
As he rides into town on his bike, his hands have other ideas and pull him into awkward situations where he tries to hide his affliction. But once he reaches his breaking point, he discovers the key to his ailment.",2018-06-09,440.0,English,USA,assets/thumbnails/YP1b_Sw62eQ.webp
YPHDGgnsgko,https://www.youtube.com/watch?v=YPHDGgnsgko,EL CLASICO,Two friends drive to a big soccer match in Mexico City. Then the police pull them over.,"Saul and Jeronimo, are psyched for El Clasico, the soccer game that has all of Mexico excited. Jeronimo is a young teen and Saul is his driver, but the two are bonded over their love of the game.
As they make their way to the game across Mexico City, Jeronimo sees a different part of the city he lives in, where he finds himself in a tight spot in Saul's barrio. But as they make their way towards the game, they run into difficulties -- ones that expose the wide gulf between the two friends, beyond just their ages and levels of experience.",2022-12-30,1171.0,English,USA,assets/thumbnails/YPHDGgnsgko.webp
YPeSa9x-JII,https://www.youtube.com/watch?v=YPeSa9x-JII,BABY GRAVY,A same-sex couple waits at roadside restaurant for the arrival of a man.,"Brona and Alex are at a rural pub just off a busy motorway. The two women are a couple, but their waiting for a man they've never met before. They're nervous, tense and excited all at once -- they're hoping the man will donate the sperm so they can have a baby.
The man is delayed, however, and all their insecurities about parenting and becoming a family begin to spill out into the open. Brona takes the process very seriously -- almost too seriously -- while Alex's optimistic, casual attitude rubs her the wrong way. When their original choice of donor seems to fall through, Brona suggests another candidate, and Alex's own insecurity comes up to the surface.",2019-08-14,699.0,English,USA,assets/thumbnails/YPeSa9x-JII.webp
YRIunt0aZcM,https://www.youtube.com/watch?v=YRIunt0aZcM,MOTH,A taxi driver returns to work after the death of his daughter. Then he comes across the young boy who may be responsible.,"Ciaran is a taxi driver just returning to work after a tragic loss. His daughter has recently died from a car accident, and the driver has walked away with no punishment. His first night is a dark, lonely one as he drives through the streets of his town, picking up sometimes troubled passengers at their most vulnerable point.
But then one of his fellow drivers has news: they spotted the driver who killed Ciaran's daughter at a club. Ciaran decides to find him. And then, in the cloak of night, he tracks down his daughter's killer to his home and enters.",2024-01-15,843.0,English,USA,assets/thumbnails/YRIunt0aZcM.webp
YVjlGxTUOx8,https://www.youtube.com/watch?v=YVjlGxTUOx8,WEREWOLF,A group of friends foolishly play a game of 'Werewolf'. Then it starts to seem real.,"A group of friends has assembled for game night at one of their homes, but their current game proves frustrating. When their hostess suggests a new game of Werewolf, much to the delight of the odd man out Kenneth, who is more than happy to serve as moderator, with his animated demeanor and his theatrical way of speaking.
The rules are explained: each person is secretly assigned the role of a villager or a werewolf. The moderator demand everyone close their eyes at ""night,"" and the werewolves gather to ""kill"" a villager. In the ""morning,"" the remaining villagers must attempt to figure out who the werewolves are, and kill a werewolf in the hopes of culling their numbers. But as this game of Werewolf gets underway, it starts to seem like more than a game. In fact, it starts to seem real.",2022-02-10,608.0,English,USA,assets/thumbnails/YVjlGxTUOx8.webp
Y_b5wYLVmyw,https://www.youtube.com/watch?v=Y_b5wYLVmyw,THE INVENTION,A young boy hatches a plan to steal cigarettes.,"Frankie is an 11-year-old young boy is growing up in Belfast in the 1960s, who loves listening to rock music on his record player. He's growing up in a fairly conservative environment -- his granny warns his head will blow up from listening to ""devil music"" on his headphones -- but he's aware of the changing currents of the world around him.
He's also becoming aware of the tension and dilemmas of the grown-ups around him, including his father, who owes money to the wrong people. He concocts a scheme to help his father, buying cigarettes for a local teen, in exchange for a seat at a local poker game. But he soon finds himself in a world where he may be in over his head.
Warm, witty and consistently compelling throughout, this coming-of-age dramedy captures a time and place through the eyes of a young boy growing up during a tumultuous time in culture. Frank treads the line between innocence and experience, but as he takes on situations that are far more mature than he can handle, he finds his relationships with his family shifting as well.",2021-08-09,1138.0,English,USA,assets/thumbnails/Y_b5wYLVmyw.webp
YoCkjAOgJJE,https://www.youtube.com/watch?v=YoCkjAOgJJE,SPELL IT OUT IN NEON,A woman stuck in the 'friend zone' takes a chance at a Halloween party.,"Beth is an aspiring young artist who has a ""thing"" going with her charming but elusive co-worker Brian. They've been hanging out after work, but she's been stuck in the ""friend zone"" with him.
But when Brian invites her to a Halloween party thrown by his friend Tristan and even dresses up with her in a couple's costume, she thinks they're going to take the next step. But before she can take that romantic leap of faith, she comes up against a few surprises.",2023-10-30,713.0,English,USA,assets/thumbnails/YoCkjAOgJJE.webp
Yokmq156UrQ,https://www.youtube.com/watch?v=Yokmq156UrQ,BURY IT,Two young brothers are sent into the forest to bury a family secret.,"Victor and Melvin are dropped off by their older brother Raymond in a rural Hawaii forest. The brother’s pickup rumbles away, and Vic and Melvin reluctantly begin their trek alone with an unopened pack and a shovel. They're not looking forward to their unnamed task, which they don't talk about.
Eventually, they reach their destination and carry out the unpleasant job they were sent to do. With the deed now behind them, they have more questions than answers, and the boys sense that what they’ve experienced may haunt them for a long time to come.",2023-10-07,691.0,English,USA,assets/thumbnails/Yokmq156UrQ.webp
YptjkyO0s0E,https://www.youtube.com/watch?v=YptjkyO0s0E,A DEATH IN THE FAMILY,A wealthy family mourns a tragic death. Then the sinister truth is revealed.,"A well-to-do family has gathered for an elegant dinner. A formal affair, they're dressed up and the meal on the table has been prepared with an eye for detail and intricacy.
But the feast is a sad affair, beginning with a toast in remembrance of a beloved, recently lost family member named Helen. As each member offers a toast to Helen, we see how Helen has affected everyone in the family, revealing a family's deeper psychodrama in the process.",2023-05-05,685.0,English,USA,assets/thumbnails/YptjkyO0s0E.webp
ZmOEN3h2D8U,https://www.youtube.com/watch?v=ZmOEN3h2D8U,RADICAL HONESTY,A guy and girl are on a great date. Then he reveals his open relationship.,"Jack and Rachel are on a great date, really connecting and enjoying one another's company. They finally end up at a late-night diner, where they bond over a disenchantment with traditional relationship structures and wonder what the next step is for the pair.
As they figure it out, Jack reveals the reality of his ""radical"" open relationship, which makes figuring out what comes next a little more complicated. As Jack and Rachel hammer it out, things take a turn for the absurd.",2023-01-16,406.0,English,USA,assets/thumbnails/ZmOEN3h2D8U.webp
_nzXk4JNdTQ,https://www.youtube.com/watch?v=_nzXk4JNdTQ,LOLA: GIRL GOT A GUN,A young girl searches for belonging in an abusive West Texas household.,"A young, innocent girl lives with her mother, brother and stepfather in the vast emptiness of West Texas, full of wide-open skies and vistas. But life at home isn't easy. Her loud, often drunken gun-loving stepfather is emotionally and physically abusive, and the young girl lives under a constant, pervasive threat of violence.
Her brother does his best to protect her while her mother tries to not cause trouble. But then the stepfather introduces the young girl to the shooting range... and soon she adopts a gun of her own, putting her own inimitable stamp on it.",2019-07-25,830.0,English,USA,assets/thumbnails/_nzXk4JNdTQ.webp
_qgjhLw9CdA,https://www.youtube.com/watch?v=_qgjhLw9CdA,FOREVER,An interracial couple falls victim to a hate crime and miraculously becomes immortal.,"Monica and Beau are a couple who are clearly in love with one another. They hang on one another's words, they spend time together in the forests and beaches near their Virginia homes and their attraction for one another is clear. But they are also of different races, living in 1940s Virginia, making their romance forbidden and even dangerous.
Their relationship is discovered, and their love for one another is tested when bigotry rears its head, putting their relationship -- and especially Monica -- in danger.
Lush, atmospheric and visually sumptuous, filmmaker Joyce Sherri uses every element in the cinematic toolbox to craft a jewelbox of a romance, exploring an interracial relationship set in 1940s Virginia.",2018-10-05,839.0,English,USA,assets/thumbnails/_qgjhLw9CdA.webp
_yhcKWgRaEo,https://www.youtube.com/watch?v=_yhcKWgRaEo,A WOMAN OF NO IMPORTANCE,An undocumented woman in New York finds herself at the crossroads.,"Ismat is a single South Asian immigrant mother who has found work as a seamstress in New York City. She is raising her young daughter on her own and works long hours at a job with a callous, demanding boss that she tolerates with the hope of getting her papers. Hard-working and dedicated, Ismat is just trying to make a life for herself and her child, and she is willing to endure any number of small indignities to survive.
But as her boss increasingly favors a new employee -- and refuses to give Ismat time off for her daughter -- Ismat begins to struggle with the inherent vulnerability of her position. But when she witnesses something furtive and distressing at her job, she finds herself with the means to get what she wants, though it might compromise her morality.",2023-09-03,1025.0,English,USA,assets/thumbnails/_yhcKWgRaEo.webp
aBOFkI9sldA,https://www.youtube.com/watch?v=aBOFkI9sldA,GUT PUNCH,"Three New Yorkers argue about pills, politics and semantics.","Bodega owner Manny and a delivery man named Rex are re-stocking the store when Brooklyn resident Dan heads into the bodega, in search of probiotics to counteract the antibiotics he's taking for an illness.
But when Dan coughs a little too much, Manny wants to boot Dan out of the bodega. Dan resists, and soon he, Manny and Rex get into an argument with Dan over probiotics, prebiotics and antibiotics, each side making passionate but ill-informed points and spinning the discussion into increasingly absurd directions.",2023-10-23,761.0,English,USA,assets/thumbnails/aBOFkI9sldA.webp
aKX-kaEk-iw,https://www.youtube.com/watch?v=aKX-kaEk-iw,CELLS,A reputable doctor is held captive by masked intruders. They don't want his money.,"A well-off doctor is trying to sleep at his luxurious home during the holidays. But his night is interrupted when a break-in occurs and he's confronted by masked intruders.
But these are no ordinary robbers. They have an agenda -- they want to know what the doctor's medical research institute does with the billions of dollars that it raises each year. As he is confronted with the stark truth, the doctor must figure out what the intruders' motives are before their grievances explode into violence.",2024-01-28,717.0,English,USA,assets/thumbnails/aKX-kaEk-iw.webp
aSkWuEL-xNA,https://www.youtube.com/watch?v=aSkWuEL-xNA,PORCUPINE,A young mother asks a 911 operator for permission to shoot an impending intruder.,"A young widow, grappling with her loss, is holed up in her house on New Year's Eve as celebrations sound off around her in the neighborhood. Tonight, though, she's tending to her newborn.
But a home intruder tries to get inside their house, sending the young mother to call 911, her own gun in hand. As the intruder ramps up their efforts, the mother asks the 911 operator for permission to shoot. What she does next may be the difference between life and death for her and her baby.",2019-07-11,605.0,English,USA,assets/thumbnails/aSkWuEL-xNA.webp
aUZEqA4X0is,https://www.youtube.com/watch?v=aUZEqA4X0is,NEITHER HERE NOR THERE,"A young man is bullied, then finds a mysterious creature in a magical bus.","Nacho has been beaten up by racist bullies in his neighborhood, and he feels a desire for vengeance growing in his heart, fueled by pain and hatred. But after taking refuge in an abandoned building site, he discovers a magical, mysterious creature hiding inside a bus.
Their initial meeting is frightening and the bus, too, is dark and foreboding. But Nacho eventually overcomes his fear, soon realizing the monster is just as scared and vulnerable as he is.",2023-09-16,730.0,English,USA,assets/thumbnails/aUZEqA4X0is.webp
ab8IUtHG1iA,https://www.youtube.com/watch?v=ab8IUtHG1iA,WAR OF COLORS,A Black woman with white skin due to Albinism struggles to fit in with society.,"In many ways, Rue is a typical young woman. Smart, hard-working and attractive, she's a writer, she comes from a loving home and family, and she has a crush on her co-worker at her restaurant job.
But Rue also has albinism, which makes life harder for her sometimes. She's not quite accepted by the Black community: to some, she's not Black enough, she's too white or she's just a ""freak."" And the white community treats her as Black. People stare at her on the bus. Her co-worker thinks she looks weird. Even in an inclusive creative community, she feels excluded. With such obstacles, Rue must find her voice, as well as her sense of acceptance.",2022-11-12,1152.0,English,USA,assets/thumbnails/ab8IUtHG1iA.webp
ag94XLIlcy8,https://www.youtube.com/watch?v=ag94XLIlcy8,FELT LOVE,"A young boy learns the depth of his mother's love, despite the distance from her dedication to work.","Bo is a young boy whose mother, Yue, works as a seamstress out of their home to make a living. Yue works hard, but his mother is often too busy working hard to make a living. Bored, Bo stays near his mother. But true to his childish nature, he's fidgety, soon falling over in his chair and distracting his mother from her work.
She banishes Bo from her workroom and tries to go back to work in peace. But she feels terrible about her difficult moment with Bo, crying onto the fabric of the shirt she is sewing. But at her lowest point, she and Bo manage to find their way back to one another and reach a shared understanding.",2023-09-27,393.0,English,USA,assets/thumbnails/ag94XLIlcy8.webp
aiDxoTVM-f8,https://www.youtube.com/watch?v=aiDxoTVM-f8,ECHOES OF YOU,"A janitor finds a homeless boy behind a theater, then teaches him to play the piano.","Andrew works as a janitor at a theater, but he's also a musician. Gifted at the piano, he's trying to get a foothold in the professional classical music world but isn't having much luck.
But unbeknownst to him, he has an audience -- a young homeless boy named Christopher, who sneaks into the theater where he works and listens whenever Andrew sneaks a moment onstage to play. The boy has an interest in music, and Andrew takes the boy under his wing, introducing him to the craft of piano as well as giving him attention and care.
But Christopher eventually disappears and Andrew's aspirations go unrealized, leaving him melancholy and disappointed. But his generosity and kindness eventually pay off, leading him to uncover the true source of his greatest fulfillment.",2020-08-28,1121.0,English,USA,assets/thumbnails/aiDxoTVM-f8.webp
ajxIjKixTFI,https://www.youtube.com/watch?v=ajxIjKixTFI,DUALITY DERBY,A racing legend and his greatest rival face off in an epic demolition derby.,"Victor Elaine is a local racing legend whose legacy is challenged by his greatest rival. Hoping to settle the score once and for all, the pair decide to square off in an epic demolition derby.
But in the sweltering days leading up to the big event, each driver faces up to their opposing views on life and racing. In doing so, they begin to come to terms with how they've shaped one another, and reach a new level of self-acceptance.",2022-01-27,1244.0,English,USA,assets/thumbnails/ajxIjKixTFI.webp
amzUp07flA8,https://www.youtube.com/watch?v=amzUp07flA8,SUMMON A FIEND,A lonely girl discovers a magical spell book -- and tries to summon a friend.,"Hazel is a little girl who is having a hard time making friends. People think she's weird, she says, and her writer father isn't much help, being weird himself. She has a hard time summoning up the courage to be brave enough to approach new people, and she feels very lonely.
But one day she finds a book in a library with a spell that she thinks will help her find a friend. She does the ritual but finds that she's misread the word ""fiend,"" therefore summoning the demon Dantalion. Irate at having an 8-year-old as a master and desiring to free himself from servitude, Dantalion decides to help Hazel in her quest -- and discovers the power of friendship in the process.",2021-06-18,902.0,English,USA,assets/thumbnails/amzUp07flA8.webp
asGey-zAoTU,https://www.youtube.com/watch?v=asGey-zAoTU,CONSPIRACY CRUISE,A group of conspiracy theorists goes on a cruise. Then their theories come true.,"Gordon Pike is an ex-musician whose career never quite panned out. Now he's a conspiracy crusader who offers a workshop on secret government, aliens and other mainstays of Internet conspiracies. But during one ""conspiracy cruise"" where he's due to give a class on the secret power structures underlying lives, he's on the verge of a meltdown.
The cruise and workshop are underattended, people who know of his music past make fun of where he is now, and in the midst of everything, Gordon spots a strange pair of people on the ship -- and how he might be the object of a conspiracy himself.",2020-09-03,747.0,English,USA,assets/thumbnails/asGey-zAoTU.webp
au0FF-o2Z1Q,https://www.youtube.com/watch?v=au0FF-o2Z1Q,OTHERHALF,A man goes to a therapist to try to put himself back together.,"A man literally ""breaks up"" with himself, and the two halves of his body split so they can pursue their different interests.
He realizes at a therapy session that his chest wants something different from his feet, and the bottom half decides to take some personal time to explore its own interests. But then the two parts find themselves falling for the same girl, they discover they might be more in harmony than they thought.",2019-08-28,590.0,English,USA,assets/thumbnails/au0FF-o2Z1Q.webp
b2OqpAHLj9E,https://www.youtube.com/watch?v=b2OqpAHLj9E,REFLECTION,A mysterious stranger confronts a teenager about a crime he's committed.,"At the crack of dawn, a mysterious stranger sits in a cafe in Kent, England, keeping an eye on the hard-working waitress during her shift. But the stranger is really waiting for her teenage son to come in.
The waitress's son, Freddy, committed a crime during the night, and he is going to confront the boy about it -- to make different choices and change his ultimate fate.",2024-01-09,931.0,English,USA,assets/thumbnails/b2OqpAHLj9E.webp
bBMqycF-pcY,https://www.youtube.com/watch?v=bBMqycF-pcY,MARGO LILY,A couple is determined to plant a tree in the middle of winter after the loss of their child.,"A couple tries to plant a small tree in their yard after the devastating loss of their child. But it's the middle of winter, and the road to growth isn't easy, as the pair both grapple with their grief and loss, separately and together.",2024-01-14,482.0,English,USA,assets/thumbnails/bBMqycF-pcY.webp
bNVsyVd0OLY,https://www.youtube.com/watch?v=bNVsyVd0OLY,ICE CREAM AND DOUGHNUTS,A young couple plans for the future -- but discovers their dreams diverge.,"Emily has come to surprise her boyfriend Robbie as he takes up his usual spot, busking on the pier. It's a pleasant surprise, and the pair amble along the pier, exploring the arcades and treats as they talk. They're at a wonderful point in their relationship, where they are both perfectly comfortable with one another but also find one another exciting and special.
Perhaps under the spell of a perfect day, the free-spirited Robbie asks Emily to move in with him. Emily is thrilled, but as they talk and imagine their lives together, the conversation reveals they each have a very different idea of what their future looks like -- and what began as a perfectly romantic afternoon leads to a quiet reckoning of their relationship's durability in the face of such different temperaments and goals.",2024-01-13,1136.0,English,USA,assets/thumbnails/bNVsyVd0OLY.webp
