id,youtube_url,title,caption,synopsis,release_date,duration,language,country,thumbnail_url
kIIKNea4_ws,https://www.youtube.com/watch?v=kIIKNea4_ws,THE BACKSEAT,A teenage girl rides local bus around the city -- and tries to make sense of the world.,"A scrappy and brash teenage girl named Shelby rides around the city on the bus with seemingly nowhere to go. She's by herself, but she offers a running commentary on people she knows, stories she's heard and the other passengers. Most people ignore her at first, except when she plays her music too loud, bothering the other people on the bus.
But when she observes someone's near brush with mortality, the experience lingers with her, especially as she seems to grapple with her sense of social invisibility.",2021-08-23,1007.0,English,USA,assets/thumbnails/kIIKNea4_ws.webp
Gi__cddQCNU,https://www.youtube.com/watch?v=Gi__cddQCNU,SONGKRAN,A coffee machine salesman falls for a boutique cafe owner on a business trip to Thailand.,"Pete has just arrived in Bangkok as the country is celebrating the festival of Songkran -- the traditional Thai New Year, where people splash and soak one another with water in the streets. It's a joyful holiday, but Pete can't participate. He's in town to make a business deal, as part of his job selling high-end coffee machines.
He gets stuck in Bangkok's infamous traffic and decides to make his way to the hotel on foot. But when he gets lost amongst the many back alleys and side streets of the city, he drops into a coffee shop for help, where he meets its proprietor Mai. As pressures mount on Pete, he heads out into the city for a night that will change the rest of his life.",2021-05-26,1604.0,English,USA,assets/thumbnails/Gi__cddQCNU.webp
4ReB0pvBLd0,https://www.youtube.com/watch?v=4ReB0pvBLd0,GUSTAV,A man wakes up with a strange tune in his head.,"Will wakes up from a restless night with a strange tune in his head. As he goes about starting his day, he thinks about it while in the shower. It floats through his head at work. He hums it in line for coffee. He just can't get it out of his head.
He finally learns the name of the song -- ""Jupiter"" by 19th century English composer Gustav Holst -- which finally allows him to do a deep dive into Holst's background and catalog. But instead of exorcising the song from his head, it only escalates the intensity of this particular earworm, making life very uncomfortable for Will indeed.",2019-05-14,704.0,English,USA,assets/thumbnails/4ReB0pvBLd0.webp
RHRQATnzU_k,https://www.youtube.com/watch?v=RHRQATnzU_k,DON'T KEEP YOUR LOVE A SECRET,A couple attends a therapy session to reignite the spark that has gone out of their relationship.,A couple attend therapy together in the hopes of reigniting the spark that has gone out of their relationship. But the problem may be more about their circumstances than about their essential compatibility.,2018-08-27,355.0,English,USA,assets/thumbnails/RHRQATnzU_k.webp
PNoS4kr9Z1U,https://www.youtube.com/watch?v=PNoS4kr9Z1U,LUCKY GIRL,An adopted Chinese girl discovers a Chinese buffet doesn't serve 'real Chinese food'.,"Esther is a nine-year-old Chinese girl who was adopted eight years ago by a Pennsylvania family. Her family loves her, and surrounds her with love, stability and affection.
But when she spends some time with a Chinese neighbor and her daughter, Esther starts to realize the balance isn't so easy. And when her family takes her out to a Chinese food buffet to celebrate her ""Gotcha Day"" -- the day she was officially adopted -- Esther realizes that it might not be ""real Chinese food,"" and questions her own identity in the process.",2021-04-02,668.0,English,USA,assets/thumbnails/PNoS4kr9Z1U.webp
lK_NK5cVkKs,https://www.youtube.com/watch?v=lK_NK5cVkKs,I GOT THIS,A young couple schemes to get DNA samples from three men who could be the father of the daughter he's helped to raise.,"Once upon a time, Chris and Jennifer dated. But then Jennifer got pregnant, and now she and Jack co-parent a little girl together.
But one day, Chris asks Jennifer to marry him, so they can make it official. But Jennifer drops a bombshell: Chris may not be the father of the daughter. And with no better options, she may move out of state with her daughter.
Desperate to keep them nearby, Chris convinces Jennifer to find the real father and get a child support settlement that will allow them to stay. But getting the DNA of other men proves trickier than expected, propelling them on an odyssey that's equal parts comical and touching -- and just a tad gross! -- to find out just who the dad is.",2019-09-27,1354.0,English,USA,assets/thumbnails/lK_NK5cVkKs.webp
bmJH1pOTzVE,https://www.youtube.com/watch?v=bmJH1pOTzVE,SUPER SOUNDS,A deaf boy who dreams of being a superhero meets a quirky girl.,"A shy, lonely young boy with superhero aspirations roams around the small coastal town that he lives in. One night as he's reading comics at a shop, he spots a curious, quirky girl, who in turn in intrigued by the boy. But when she spots him later and tries to strike up a conversation, he flees.
He's afraid that she will discover his secret and does his best to avoid her. But she continues to try to reach out until the boy starts to find his courage -- and a fortuitous encounter gives him the chance to act as the superhero he dreams of being.",2020-08-17,807.0,English,USA,assets/thumbnails/bmJH1pOTzVE.webp
IMAr5T5B86U,https://www.youtube.com/watch?v=IMAr5T5B86U,FIGHTER,A teenage boxer with Down syndrome fights for his right to get in the ring.,"One boxer with Down syndrome is on the verge of the match of his life. The crowds are screaming, and the promoter is anxious to get the bout going.
But in the back rooms, he faces a bigger ordeal: should he even be allowed to fight at all? As his trainer father and his concerned sister fight it out, the fighter faces a difficult choice.",2018-01-25,443.0,English,USA,assets/thumbnails/IMAr5T5B86U.webp
MUItjDX1gxQ,https://www.youtube.com/watch?v=MUItjDX1gxQ,PAPARAZZA,A photographer falls on hard times and becomes a paparraza to support her family.,"Camilla is a photographer currently freelancing on the celebrity candid circuit, grabbing pictures of movie and music stars that she can sell to tabloids and other entertainment news outlets. She wants more for herself as an artist, but she also has taken on the financial and emotional responsibility of helping her sister Esme get the treatment she needs to treat her long-term eating disorder. So Camilla needs to keep freelancing as a paparazzi photographer to pay the growing number of bills.
When Esme's outpatient facility tells Camilla that she's late on payments, Camilla awkwardly calls in a favor for a tip and gets one: a prominent pop star has entered a private rehab, and the first pics will command a large amount of money. Camilla goes in pursuit of the now reclusive singer but is faced with an ethical and moral dilemma.",2021-07-28,1011.0,English,USA,assets/thumbnails/MUItjDX1gxQ.webp
n_ZBpiQbNZs,https://www.youtube.com/watch?v=n_ZBpiQbNZs,PARTNERS,"When a slump in a couple's sex life forces them to reconsider their relationship, they must confront how intertwined their lives have become.","Long-term couple Kate and Leigh navigates a recent rocky patch in their relationship, but as still-lingering conflicts and resentments begin to surface, they find themselves facing a crucial juncture and confronting just how intertwined their lives have become.",2018-07-14,409.0,English,USA,assets/thumbnails/n_ZBpiQbNZs.webp
EMn0dyQU8gM,https://www.youtube.com/watch?v=EMn0dyQU8gM,WINTER COAT,A young boy commits a petty crime that reveals a unique bond with his neighbor.,"A woman and a young boy go out to lunch and run errands together in East London, wandering from their housing estate into the city. They chat about their days and their lives with ease and then buy a winter coat together.
But an act of petty crime reveals a much more subtle and intricate connection between the pair, one whose bond both persists and strengthens in difficult circumstances.",2021-02-26,650.0,English,USA,assets/thumbnails/EMn0dyQU8gM.webp
ggg1rDeo8E0,https://www.youtube.com/watch?v=ggg1rDeo8E0,THE SHADOW OF CAIRO,A young girl sets out to become a superhero vigilante after her mother's death.,"Maya is a young Egyptian girl whose mother has recently died while undergoing surgery. Still deep in mourning, she believes the surgeon who operated on her mother was beset by evil forces. Immersed in contemporary superhero imagery and stories, she decided to fight these ""monsters"" by becoming a superhero vigilante out to avenge her mother.
Maya takes on some criminals on her own, managing to triumph in her adventures. But when she confronts a group of opponents that may be beyond her capacity, she may have to call on a different set of powers to overcome them.",2020-09-30,907.0,English,USA,assets/thumbnails/ggg1rDeo8E0.webp
5qCZqW35Hxc,https://www.youtube.com/watch?v=5qCZqW35Hxc,VERDE,"Two sisters have always been inseparable, but when their cousins come over on a hot summer day, one learns that her sister's priorities might be changing.","Emilia and Martina are two sisters who are just hanging out one hot summer day at their home in Colombia. Close to inseparable, older sister Martina at the precipice between childhood and adult life. But the pair still play and laugh together in their hermetic paradise.
But their bond is changed when some of their cousins pay them a visit, and as the whispers of a changing family dynamic arise in the background, one sister discovers that the other is changing, almost right before her eyes.",2019-02-12,595.0,English,USA,assets/thumbnails/5qCZqW35Hxc.webp
Wx5mseklIoQ,https://www.youtube.com/watch?v=Wx5mseklIoQ,CONTROL,A husband wants to get rid of the nanny. But his wife doesn't agree for a reason.,"Mike and Olivia are a couple with a young family living in London. But as their children are getting older, Mike thinks they should let go of their au pair, Sofia, who's been with them for four years.
Olivia, however, is reluctant to let Sofia go, which causes disagreement with her husband. Olivia wants to convince Mike to keep Sofia on... but she has to do so without revealing her ulterior motives.",2020-11-05,871.0,English,USA,assets/thumbnails/Wx5mseklIoQ.webp
ETHEXAnY0qg,https://www.youtube.com/watch?v=ETHEXAnY0qg,TIME,A couple goes to an isolated place for intimacy. But they don't have much time.,"Maggie is celebrating her birthday with her lover Ryan, and the two of them spend a leisurely weekend with one another sequestered away in an apartment. During their time together, they make love, talk and hang out, losing themselves in a cocoon of intimacy. There are no kids, no work or no distractions; there is only one another.
But as the weekend goes on, they steadily avoid a certain subject, though it's inevitable that it will intrude upon their relationship. Maggie must face the truth of her love for Ryan and its inherent limitations -- and choose between the loneliness of commitment or the uncertainty of freedom.",2022-10-22,563.0,English,USA,assets/thumbnails/ETHEXAnY0qg.webp
MZiFYdrDN8Q,https://www.youtube.com/watch?v=MZiFYdrDN8Q,"SORRY, NOT SORRY",A man eats his wife's plums. Then all hell breaks loose.,"Harry lives in his home with his cranky, invalid father, while in the midst of growing hostility with his wife Abby. Both husband and wife come and go, managing to avoid one another at the house.
But when Harry eats a bowl of plums that Abby clearly wants to be saved, it sets off a domestic skirmish that escalates into a full-fledged war involving destruction of property, infidelity and eventually... murder.",2020-04-02,458.0,English,USA,assets/thumbnails/MZiFYdrDN8Q.webp
Y4NFFSsd4hk,https://www.youtube.com/watch?v=Y4NFFSsd4hk,THE GESTURE AND THE WORD,A postman secretly recreates postcards for a woman on his postal route after her boyfriend stops sending them.,"Gilbert is a lonely postman whose only friends are the people on his route. There's Mr. Rostall, a blind widower and retired poet and professor. There's Aurore, who gets postcards from her boyfriend Eric as he travels around the world. And then there is Eloise, a lovely florist in the neighborhood who gives Gilbert a flower for his jacket every day, along with a lesson in the symbolism in each bloom and a hopeful sign of her affections.
When Aurore suddenly stops receiving postcards from Eric, Gilbert secretly begins to recreate them, recruiting Mr. Rostalle, who believes he's helping Gilbert express his growing feelings for Eloise. But the effort has unintended consequences, and Gilbert must deal with his fears and inability to express himself with Eloise.",2021-11-02,1363.0,English,USA,assets/thumbnails/Y4NFFSsd4hk.webp
E_zJgHRl6eI,https://www.youtube.com/watch?v=E_zJgHRl6eI,RETOUCH,An Iranian woman must make a difficult choice: save her husband or save herself.,"Young mother Maryam is getting ready one morning, trying to balance preparing her child for the day while her husband begins an exercise session.
But then her husband calls out from the other room, trapped underneath a heavy weight he was lifting. His life in the balance, Maryam initially makes a few attempts to help, but the weights are too heavy and stuck. She watches as he dies before her eyes -- giving her a moral dilemma, and a chance to remake her life.",2019-06-25,1173.0,English,USA,assets/thumbnails/E_zJgHRl6eI.webp
K2SpQj6vPlQ,https://www.youtube.com/watch?v=K2SpQj6vPlQ,SUBURBIA,An ordinary day in suburbia is shattered by a gunshot sound.,"It's just an ordinary day when Joel arrives at a florist's shop to pick up his girlfriend on her first day of work. When he's there waiting in the doorway, a car careens down the street, but Joel thinks nothing of it.
But when he leads his girlfriend from the shop to their car, they hear a sound that could be a gunshot. Unsure of what he's heard, Joel sets off to investigate the sound... and walks right into a nightmare.",2018-03-09,900.0,English,USA,assets/thumbnails/K2SpQj6vPlQ.webp
99vwLjvknN8,https://www.youtube.com/watch?v=99vwLjvknN8,THE CRITIC,An award-winning actress with a troubled past faces her harshest critic during an interview gone wrong.,"An award-winning actress has just won acclaim for her performance as a woman who struggles with drug and alcohol addiction. But then she is interviewed at her home by a particularly combative critic. And as she's pummeled with questions, the interview goes awry, and her carefully polished surface begins to unravel.",2020-10-23,901.0,English,USA,assets/thumbnails/99vwLjvknN8.webp
jNQbp1CADEw,https://www.youtube.com/watch?v=jNQbp1CADEw,MAY I HAVE THIS SEAT,A pregnant woman asks a man for his seat on a bus -- but he refuses.,"During the smoggy season in Lahore, Pakistan, a very pregnant Sonia is running late to her doctor's appointment. She gets on the city bus, where she heads to the women's section of the bus, which is full. A few rows away in the men's section, she notes a man sitting with his son and asks him for his seat. He refuses, and after a few tense words, Sonia looks elsewhere.
But when the bus hits a bump, causing Sonia to lose balance and fall into the man's lap, he grabs her. Sonia then accuses the man of harassing her, and they get into a verbal altercation that soon draws the attention, opinions and involvement of everyone on the bus. And when Sonia and the bystanders get their social media involved, the tension escalates to an unpredictable point.",2023-02-04,616.0,English,USA,assets/thumbnails/jNQbp1CADEw.webp
mvEdgCjInI8,https://www.youtube.com/watch?v=mvEdgCjInI8,SEND IN THE CLOWNS,A clown who struggles to make ends meet gets a chance to make money.,"A clown clocks in and out of work, day after day, making ends meet. But when he's late to a birthday party gig and chewed out by an irate mother, he's dropped from the company he works for.
Soon he is struggling, running out of money and having a hard time finding work and purpose. One day, he comes across a chance to get some much-needed cash. But it puts him at odds with the authorities, putting him in a situation he can't clown his way out of.",2023-04-06,777.0,English,USA,assets/thumbnails/mvEdgCjInI8.webp
nEa9LoH6xPE,https://www.youtube.com/watch?v=nEa9LoH6xPE,LADY BRENTLY'S END,A young woman tries to convince her newly widowed sister that life is worth living.,"Louise has just heard some terrible news: her husband, Lord Brently, has been killed in a carriage accident. With his death, she also fears for her loss of financial security and social status, since having a husband is the only way a woman can secure her future in Victorian-era England.
But her sister Josephine offers comfort to her distraught sister. Josephine is more liberated than Louise and attempts to convince her more old-fashioned sister that perhaps there is hope in a future where she can shape her destiny and not be confined to increasingly archaic rules. Louise is skeptical and nervous, but she begins to see that Josephine just might have a point.",2023-05-27,372.0,English,USA,assets/thumbnails/nEa9LoH6xPE.webp
wMkXaj-CrMA,https://www.youtube.com/watch?v=wMkXaj-CrMA,MELONS,A grocery store manager learns to stand up for himself after a sexual harassment misunderstanding.,"Amiable, decent and humble, Nigel is the manager at Sunnyside Grocers. In his element in his job and devoted to superb customer service, he is beloved by customers and employees alike.
But when a would-be influencer wrongly accuses Nigel of sexually harassing a customer, Nigel finds his world and reputation crumbling in the crosshairs of viral social media attention that cares more about expressing outrage than hearing the nuances of the truth. To save everything that matters to Nigel, he must learn to stand up for himself — or risk losing it all.",2023-02-16,940.0,English,USA,assets/thumbnails/wMkXaj-CrMA.webp
1-facD9iuyQ,https://www.youtube.com/watch?v=1-facD9iuyQ,THE SECRET MARKET,A doctor rises to become chief surgeon. But her past comes back to haunt her.,"Amy is a successful surgeon who receives a message one evening at her office, telling her to call a number for a mysterious auction: a secret that concerns her is up for the highest bidder. If she doesn't buy her secret, it will be released to the general public.
She enlists the help of a lawyer, but the lawyer can offer no help. But in her quest to learn more, Amy finds herself pulled in an increasingly dark, sinister underworld of the ""secret market"" -- one that threatens the life she's worked so hard to build for herself.",2022-03-25,1347.0,English,USA,assets/thumbnails/1-facD9iuyQ.webp
eMyFsEIpfmY,https://www.youtube.com/watch?v=eMyFsEIpfmY,CUL-DE-SAC,A private investigator's stake-out is interrupted by his sister who's decided to fix his life.,"Chris Pond is just your everyday normal private investigator. He's a dad who can't quite connect with his kid, and his marriage is floundering. He's thrown himself into his work to take his mind off his worries.
But he finds his routine stakeout interrupted by his sister Lottie, who's intent on improving her brother's life. She stages an intervention aimed at getting Chris out of his rut -- at the worst possible time.",2018-03-12,723.0,English,USA,assets/thumbnails/eMyFsEIpfmY.webp
GN1cRSEwOdo,https://www.youtube.com/watch?v=GN1cRSEwOdo,TALK RADIO,A woman overhears her husband reveal a lifetime of regrets on a talk radio show.,"Pauline and Barry are a long-married middle-aged couple who have settled into a nice, comfortable life together. At least that's what Pauline thinks -- until she tunes into the relationship hour on her local talk radio station and recognizes the voice of the current live caller. It's her husband, relaying a lifetime of resentment, ennui and regrets to a public audience.
Pauline is devastated as the calling details a litany of complaints. But as he goes on, he seems to come to a point of illumination: one that just might change the course of his marriage.",2021-06-15,526.0,English,USA,assets/thumbnails/GN1cRSEwOdo.webp
Fj0NuC7J1Uo,https://www.youtube.com/watch?v=Fj0NuC7J1Uo,CHLORINE,A neglected girl steals from pregnant women at the local swimming pool.,"Keira is a neglected 11-year-old who steals from pregnant women in the prenatal class at her local pool. She is left on her own a lot, and when she's home, her caretaker Beth is too busy enjoying the heady, hedonistic freedoms of young adulthood and new romance to pay Keira much attention.
Starved of care and attention, Keira attempts to fit into Beth's world as quietly as possible. But when she discovers Beth's dreams for the future, Keira acts out and threatens the very existence of their small family.",2021-08-26,1025.0,English,USA,assets/thumbnails/Fj0NuC7J1Uo.webp
AzNgVAGABRo,https://www.youtube.com/watch?v=AzNgVAGABRo,PAUL,A young man with HIV attends a dinner with a family he's never met.,"In the late 1980s, and the news is filled with anxious, fraught stories of an epidemic spreading in the U.S. Not much is known about this disease called AIDS, or the virus that causes it. But with no treatment or cure, most people believe it's a death sentence.
Paul is a young man who has been diagnosed with this virus -- H.I.V. -- and has since isolated himself from society, and from connection in general. But he's compelled by a local pastor named Father George to get out of his house and meet with the family of the pastor's niece, a woman named Nora. But the dinner forces him to confront his fears and his own judgment of himself.",2020-10-03,673.0,English,USA,assets/thumbnails/AzNgVAGABRo.webp
EyEI09sRqek,https://www.youtube.com/watch?v=EyEI09sRqek,CLAC,A mother plans to kill herself during a family dinner at a Chinese restaurant.,"A family has gathered for dinner at a chic Chinese restaurant. Their genial night out, though, is interrupted when the mother has an announcement: she's going to kill herself that night.
The family takes in this shocking pronouncement and news, destabilizing any pretense of equanimity and civility. (Even the senile grandmother seems affected by what's unraveling.) The resulting freakout uncovers a whole series of secrets, resentments and unspoken truths lingering under the surface.",2021-06-22,1175.0,English,USA,assets/thumbnails/EyEI09sRqek.webp
KUeCOtSqHlI,https://www.youtube.com/watch?v=KUeCOtSqHlI,LITTLE LAMB,A young convict woman chooses a new master. But her hopes for a new life are undermined by the grim truths she discovers.,"It's 1829, and Louisa is a convict trapped in a horrific, decrepit British prison in Van Dieman's Land -- the original name of the island of Tasmania, which was used as the primary penal colony in Australia.
Louisa is desperate for freedom and will do almost anything to get out of prison. A mysterious Mr. Black arrives to choose a servant for his household, but despite warnings from her fellow inmate, she puts herself forward, literally, to be chosen.
But life on his remote farm isn't easy. Her new master is abrupt, strange and seems to harbor not-so-honorable intentions towards Louisa, and she's at his mercy in such an isolated setting. Her only solace is befriending an orphaned lamb on the farm. But when she unearths some grim truths hidden in the darkness, she realizes that her desperate grab for freedom may be the path to danger.",2019-10-30,1335.0,English,USA,assets/thumbnails/KUeCOtSqHlI.webp
4D2xY7CrUCE,https://www.youtube.com/watch?v=4D2xY7CrUCE,BOUND,Two strangers wake up handcuffed together after a night out.,"Kelsey and Martin are at a nightclub, eyeing up one another in a drunken haze. They're strangers who have caught one another's eye amidst the music, crowds and alcohol during some kind of wild night out.
But the next thing they know, they're waking up in the same bed -- and discover they're handcuffed together. Now the pair are forced to prolong their one-night assignation, and must work together to make it through the day until they can figure out a way to free themselves of one another.",2023-05-12,809.0,English,USA,assets/thumbnails/4D2xY7CrUCE.webp
vDEVVwkr3F8,https://www.youtube.com/watch?v=vDEVVwkr3F8,REVENGE TOUR,A young man is angry for being cheated on. Then he finds a way to move on -- rapping.,"Derek ""Milkshake"" Qamar has been cheated on. He's also stuck in a dead-end job and sleeps in the living room of his music producer friend Helen. In other words, Derek is stuck, ever since he broke up with his girlfriend Maria almost a year earlier.
Derek can't seem to find his way out of his depression. But then he finds a way to put his anger and hurt into lyrics and lays down a track that will eventually change his life.",2021-07-26,809.0,English,USA,assets/thumbnails/vDEVVwkr3F8.webp
Had-HFeAtx8,https://www.youtube.com/watch?v=Had-HFeAtx8,THE GOLDFISH,An adopted woman confronts her darkest fear at her sister's baby shower.,"Audre and her husband Jason are trying to start a family. But then Audrey attends her pregnant sister's party, full of kids and her sister's ""Lamaze-ma"" group. It's as if Audre has been dropped off on another planet, full of maternal domesticity.
At the party, Audre deals with questions about being adopted, her fertility and her baby-making plans, often in off-putting and tone-deaf conversations. And as the afternoon turns into evening, Audrey must face and come to terms with her fears and ambivalence about pregnancy and motherhood.",2022-05-08,1030.0,English,USA,assets/thumbnails/Had-HFeAtx8.webp
