id,youtube_url,title,caption,synopsis,release_date,duration,language,country,thumbnail_url
0EzjmIdR32Q,https://www.youtube.com/watch?v=0EzjmIdR32Q,IN THE JAM JAR,An elderly woman in her final days reflects on her relationship with her son.,"Joan is in her 80s and is approaching the end of her life. As she makes her way through the days, she contemplates her relationship with her 50-year-old son Dan, from his early days as a baby to her marriage to Dan's father to their more distant relationship as adults.
Dan, too, mulls over the presence of his mother in his life after she passes. He looks for signs of her after her death, hoping to find them in even the oddest of places -- and discovering that even when she's gone, she still makes her presence and love felt in the small, delicate details of life.",2023-11-17,773.0,English,USA,assets/thumbnails/0EzjmIdR32Q.webp
0Kq0yXy173s,https://www.youtube.com/watch?v=0Kq0yXy173s,FOR SALE,Two lovers drive to a remote town in Italy. But it's completely empty.,"Young lovers Luca and Carla are driving in the hills of Italy, enjoying the picturesque ride as well as one another. They're on their way to a remote small town to buy and pick up a second-hand TV whose ad they answered online. But with their romance, the occasion has turned into an adventure.
But things seem off when they arrive in town and find it devoid of inhabitants. There are no people around, except for their seller, a worn-down older man named Levi. And when they enter Mr. Levi's home, the transaction takes more than a few dark turns, as one venal act is answered with another.",2023-07-25,907.0,English,USA,assets/thumbnails/0Kq0yXy173s.webp
0ne_aVYMSaQ,https://www.youtube.com/watch?v=0ne_aVYMSaQ,DADDY'S NIGHT,A father invites a woman home as the mother is out. Then his daughter wakes up.,"Mommy is going out for the night, leaving Daddy home to put their daughter Betsy to sleep. Daddy is happy to get her to bed because that means he can invite his extramarital love Natalie over for a dalliance while his wife away.
But Daddy's plan goes awry when Betsy wakes up, afraid of a monster. Daddy does everything he can to pacify his young daughter, but her fear keeps her awake -- and keeps Daddy away from Natalie. As Betsy grows insistent and Natalie's patience grows thin, Daddy's time with his paramour is running out.",2024-02-10,1091.0,English,USA,assets/thumbnails/0ne_aVYMSaQ.webp
0oSfCquEOrQ,https://www.youtube.com/watch?v=0oSfCquEOrQ,GROUP C,A timid man joins a mysterious support group to boost his confidence.,"Naveen is a shy, unassertive family man. He has a loving home life, but he often finds himself bulldozed at work. After one particularly pointed public humiliation, a sympathetic client tells Naveen about a support group aimed at boosting the confidence of people like him. Reluctant to explore at first, Naveen eventually decides to seek the group out.
He discovers the group is exactly what he needs, tapping into his ""inner child"" with unconventional preschool activities that heal his shyness and inability to assert himself. His membership in the group improves his real life and his standing at work, but when Naveen tries to move on from the group, he discovers that the group isn't as fun and benevolent as it seems.",2024-03-13,1002.0,English,USA,assets/thumbnails/0oSfCquEOrQ.webp
0rdYtxEjLDU,https://www.youtube.com/watch?v=0rdYtxEjLDU,TALIA,"A young girl discovers her neighbor loves natures, then strikes up an unusual friendship.","Talia is a little girl living in the city with her father. But despite her location, she's still fascinated by nature and finds any opportunity to explore the world around her, much to her protective father's consternation.
When Talia discovers her next-door neighbor shares her love and fascination with nature, an unusual friendship develops between them. But Talia's emboldened interest -- and her growing independence -- challenges her relationship with her father even more.",2023-11-06,605.0,English,USA,assets/thumbnails/0rdYtxEjLDU.webp
0sR05KZd-9o,https://www.youtube.com/watch?v=0sR05KZd-9o,ALEX,A Black woman is accused of shoplifting. Then it escalates out of control.,"Sydney is out with her friend Madi, both of them enjoying an afternoon of shopping. But then they wander into a hip, high-end boutique, presided over by a sales associate named Alex. The two friends chatter, and the sales associate, Alex, is seemingly friendly, welcoming and solicitous of both women, even telling Madi about a job at the store and starting dressing rooms for both.
But Sydney feels uneasy, not finding the merchandise to be inclusive of her Black skin tone and the prices to be high. She gives up on shopping and waits for Madi outside the dressing room. But when Alex doesn't find one of the items left behind in the dressing room, she accuses Sydney of shoplifting, leading to a nerve-racking, explosive chain of events.",2023-08-26,535.0,English,USA,assets/thumbnails/0sR05KZd-9o.webp
0y5X1GFjH3w,https://www.youtube.com/watch?v=0y5X1GFjH3w,DOESN'T FALL FAR,A father and son have a secret that comes to light in the span of an evening.,"Carson, his son Garrett and his wife Elsie are sitting down for a late dinner during the holiday season. But they aren't an ideal picture of family togetherness, and the meal is full of complaints, stubborn silences and passive-aggressive comments, though Carson attempts to retain his equanimity through it all.
But he is still dissatisfied and lonely and seeks out a diversion -- one that will unearth a minefield of secrets of both father and son. When they come out into the open, the pair must decide how to move forward in an attempt to salvage their relationship.",2021-08-28,901.0,English,USA,assets/thumbnails/0y5X1GFjH3w.webp
154vcw0-svk,https://www.youtube.com/watch?v=154vcw0-svk,THE PERFECT WEEK,A heartbroken woman goes on a new date every night for a week.,"Izzie has just broken up with her boyfriend, and it's been hard. She's lethargic and very sad. Her friend suggests an antidote to lift her spirits: a ""perfect week"" where she goes on a new date each night over the seven days.
Izzie decides to go for it, lining up a date for each night. Each night is unique, and each guy is different, offering a new lesson or at least a new story to tell. But will it help Izzie get over her breakup?",2023-03-04,1243.0,English,USA,assets/thumbnails/154vcw0-svk.webp
1GKC362VI9E,https://www.youtube.com/watch?v=1GKC362VI9E,SYNCNIFICANT,A young woman tries to salvage her husband's memories of their marriage.,"Parker is a young wife who has been fighting a lot with her husband Sam, who is also a robot, a ""syncnificant other."" As their fights become more heated and intense, Sam freezes, and Parker calls customer service to get Sam fixed.
But customer service says that Parker must get an entirely new replacement. However, this means that Parker will have to ""start over"" with a new mate -- and leave behind all her old memories of her times with Sam.",2023-08-11,438.0,English,USA,assets/thumbnails/1GKC362VI9E.webp
1U3Lv98Pdjw,https://www.youtube.com/watch?v=1U3Lv98Pdjw,SWIM,Two swimmers develop a strong friendship during their weekly sessions.,"Luke is a regular swimmer at a local pool when he notices someone new beginning to swim regularly as well. The new swimmer's name is Sid, and over time, they strike up a friendship, chatting amiably whenever their paths cross.
Luke eventually invites Sid out to join him and his friends for a drink. But outside of the pool, their true identities are revealed to one another and their friendship is tested.",2023-12-04,570.0,English,USA,assets/thumbnails/1U3Lv98Pdjw.webp
1Ul0tZifG-k,https://www.youtube.com/watch?v=1Ul0tZifG-k,THE INVISIBLE MAN,Low-level drug traffickers share a secret: they have high value narcotics stashed in a barn somewhere. But they also have a debt to pay.,"Low-level drug traffickers, Nick and Kid, have half a million euros in heroine stashed in an upstate barn. But they also have a debt to pay -- to a canny operator named Frank, who suddenly turns up at their hideout looking to collect.
When they don't pony up, they're obliged to settle their score with a tense game of Russian roulette -- and each round brings up a secret about each person in the room.",2018-02-19,615.0,English,USA,assets/thumbnails/1Ul0tZifG-k.webp
1qr3mrTt3vw,https://www.youtube.com/watch?v=1qr3mrTt3vw,STEP RIGHT UP,A man's ex-wife cancels their son's birthday party. So he proceeds with the clown.,"Dan is divorced from his ex-wife Liz, who has custody of their son John. When she cancels Dan's party for John's 8th birthday after a mysterious paternal transgression, Dan decides to proceed with the the one person who turns up as planned: the clown.
Together they decide to bring Dan's present to his son, setting up a potentially difficult encounter with Liz and her new boyfriend. But getting to John proves more difficult than expected, putting Dan into a sticky situation that forces him to hear some difficult things -- but also gives him the impetus to be the dad he knows he can be.",2019-09-27,557.0,English,USA,assets/thumbnails/1qr3mrTt3vw.webp
2FV4c4Dx1Zo,https://www.youtube.com/watch?v=2FV4c4Dx1Zo,HAIRCUT,A modern couple can't connect over her new short hair.,"Lindsey and Josh are a young, seemingly upwardly mobile couple living together and sharing a life.
But one day Lindsey comes home with a new shorter haircut. When it fails to elicit the right amount of support and reassurance from Josh, an argument develops between them, unearthing repressed resentments and deeper conflicts they've buried in the day-to-day of their life together.",2019-08-06,407.0,English,USA,assets/thumbnails/2FV4c4Dx1Zo.webp
2MtihfzzSrs,https://www.youtube.com/watch?v=2MtihfzzSrs,HIP HIP HOORAY,"A man breaks up with his girlfriend, right before she throws him a surprise party.","Harry and Anna have been living together for two years, after dating for four. But on his 30th birthday, he breaks up with her. But breaking up is hard to do, especially when Anna's planned surprise party continues to bubble onward, throwing a wrench into the process.",2019-05-12,780.0,English,USA,assets/thumbnails/2MtihfzzSrs.webp
2PjPOeZb3n4,https://www.youtube.com/watch?v=2PjPOeZb3n4,EVERYBODY DIES SOMETIMES,A young woman believes she kills everyone she loves.,"Mara is a young woman who has been a little stunted in life, mostly because she suffers from crippling anxiety: she believes that she somehow kills anyone who gets close to her. Not through homicide, of course. But by knowing her, her loved ones suffer premature deaths, or so she believes.
As a result, Mara is lonely and awkward, with no friends and no lasting relationships. But when she becomes pregnant, she must confront her anxieties about death before starting the most important relationship of her life.",2024-03-05,541.0,English,USA,assets/thumbnails/2PjPOeZb3n4.webp
2RMH-an4eA0,https://www.youtube.com/watch?v=2RMH-an4eA0,INCOMING MAIL,Two best friends are sent 30 years into future via a magical mailbox.,"It's 1985 and the summer before senior year for best friends Clementine and Ava. Clementine is an aspiring Hollywood star and Ava is a garage rocker. They love to goof off, but Clementine has something most rising high school seniors don't: she can exchange letters with her future self via a magical mailbox. With these letters, she gets advice and affirmation about what she's going on in her life.
But one day, Clementine stops getting letters back. Panicking, she accidentally zaps her and Ava through the mailbox all the way to 2015. The future is strange, with its robotic vacuums and mysterious ""clap-on"" lights. But Clementine also discovers that her future isn't as glamorous as she hoped, and meeting Future Clementine is a huge disappointment. So it's up to Future Clementine to teach her teenage self some key lessons -- or else risk missing out on the most important lessons of all.",2023-08-21,832.0,English,USA,assets/thumbnails/2RMH-an4eA0.webp
2RaYQFZTVx0,https://www.youtube.com/watch?v=2RaYQFZTVx0,ENTRENCHED,A team of soldiers capture an Afghan boy -- but their position is compromised.,"Four soldiers from Australia are holed up in a room in Afghanistan, doing reconnaissance in a village. They are very different personalities with different worldviews, but they have to work together as soldiers, though the close quarters of their position make it harder to get along.
But their relative harmony is disrupted when a young Afghan boy enters the room. Startled and suspicious, the soldiers take the boy prisoner. He speaks no English, and the soldiers debate whether or not he's a spy scouting out the position of the soldiers for the Taliban. But in the unpredictability of war, the debate takes on heightened stakes as the world falls apart around them.",2023-11-07,842.0,English,USA,assets/thumbnails/2RaYQFZTVx0.webp
2TlC18CLjYw,https://www.youtube.com/watch?v=2TlC18CLjYw,HE COULD'VE GONE PRO,A woman and her mother confront the truth about their family's past.,"Gayle is the middle-aged matriarch of a Southern family, calling each member of her clan on  Christmas. She's keen on maintaining connection, even if the family members are far away, going through her list and beginning each call with a ""Happy ho ho ho.""
But then her daughter Debbie arrives for Christmas with her boyfriend, initially to collect her gift money, despite a lingering anger at her mother. But Debbie refuses to comply with Gayle's attempts at normalcy, eventually rupturing Gayle's illusion of familial bliss and forcing Gayle to confront their troubled past as a family.",2019-08-08,789.0,English,USA,assets/thumbnails/2TlC18CLjYw.webp
2ZfxjPXT8Hc,https://www.youtube.com/watch?v=2ZfxjPXT8Hc,AFTERWORD,A young woman walks up to the mic and gives the speech of her life.,"A young woman approaches the microphone in a small room. Aiming to be heard loud and clear, she begins to speak, desperate to find her place in the wake of a relationship that has ended.
But as she speaks, she stumbles onto something even greater: the speech of her life, and a manifesto for living.",2023-10-15,593.0,English,USA,assets/thumbnails/2ZfxjPXT8Hc.webp
2ZoJgDh_s_0,https://www.youtube.com/watch?v=2ZoJgDh_s_0,A BLOSSOM IN THE NIGHT,A young woman runs from a dystopian government that sells low-income citizens into slavery.,"Society has collapsed after its natural resources have been exhausted, and what remnants of government remain now enslave low-income people to address labor shortages. But many are fleeing the country to seek freedom, among them Amara, a young teenage girl, and her older brother Donovan. They've joined an ad-hoc community of fellow freedom seekers, banding together, sharing resources and learning to fight back against the poachers who make money ""recollecting"" them.
Amara is learning how to survive, but as a fighter, she's not quite there. And she misses her father, who she and Donovan have left behind in their desperate flight from slavery. But when Amara gets a sign that their father may be nearby, she must decide whether to move forward to freedom or keep hold of the dream of a reunited family.",2024-01-11,1036.0,English,USA,assets/thumbnails/2ZoJgDh_s_0.webp
2aLsdH7wzTI,https://www.youtube.com/watch?v=2aLsdH7wzTI,SWING FOR THE FENCES,A woman turns to the boxing ring to overcome the anger inside of her.,"Kelly lives with and cares for her grandmother Cath, who is in the early grips of dementia. It's a hard job, especially when Cath lashes out at Kelly.
Kelly has few outlets for her stress, but she finds relief at a local boxing gym. As things come to a head at home, she must learn to master the anger building up inside of her -- or end up like her mother.",2023-06-22,876.0,English,USA,assets/thumbnails/2aLsdH7wzTI.webp
2pRTifDyljE,https://www.youtube.com/watch?v=2pRTifDyljE,ROAM,A teenage boy must choose between his friends and his future.,"A teenage boy is at a crossroads in life. Like many teens, he's enamored of his friends, and loves the feeling of belonging he gets from them as they prowl the streets of Vancouver, looking for adventures at night.
But he comes to realize that his friends are not the people he thought they were, and must think hard about who he truly is and what he values.",2019-03-31,675.0,English,USA,assets/thumbnails/2pRTifDyljE.webp
2zMdnCgO8nI,https://www.youtube.com/watch?v=2zMdnCgO8nI,CHIPPER,A wayward son returns to his childhood home to wrestle with a dark family secret.,"Estranged from his family, Reese hasn't been back to his hometown in a while, preferring instead to wander the country on his motorcycle. But after he gets a strange, mysterious letter from his father, he decides to head back to his childhood home, where his sister Carol lives with their dad.
Reese discovers his father is dying, as well as a dark family secret that would change their dynamic forever if known. As pressure mounts, Reese is forced to make a painful decision -- but can he make it without destroying what's left of his family?",2024-01-12,1254.0,English,USA,assets/thumbnails/2zMdnCgO8nI.webp
3BJGkxkfl4U,https://www.youtube.com/watch?v=3BJGkxkfl4U,FIND THE LIGHT,"A young swimmer is attacked by classmates, then considers the unthinkable.","Zak is a young British-Pakistani man who was recently viciously attacked by a group of his classmates.  Traumatized by the violence and already reeling from the instability at home, Zak feels utterly alone.
Swimming at a local pool, Zak ponders the unthinkable. But a friendly, sympathetic lifeguard — the only one who notices Zak’s wounds — comes to his rescue in more ways than one.",2023-08-18,700.0,English,USA,assets/thumbnails/3BJGkxkfl4U.webp
3BMUDAaxCrY,https://www.youtube.com/watch?v=3BMUDAaxCrY,ONE DAY HOME,A heartbroken woman shops for the 'perfect mattress' and gets more than she expected.,"Frida is at a mattress store, but the task of buying a new one is proving surprisingly hard.
She's surrounded by couples and families all on the same errand, reminding her of what she doesn't have: she split recently from her husband and is on the hunt for a new bed as a result.
But then she ends up meeting an intriguing stranger named Adam, who is also sitting on the same mattress she's on. They end up sharing a spark, helping Friday remember just what beds are for.",2020-04-22,752.0,English,USA,assets/thumbnails/3BMUDAaxCrY.webp
3PejXWtS4xs,https://www.youtube.com/watch?v=3PejXWtS4xs,TIME TO KILL,A hitman waits for his mark to get home.,"A lone hitman, Harris, sits in the apartment of his latest target, gun in hand, and waits for his mark to arrive. But his victim doesn't arrive at the expected time, leaving Harris to his own devices to contemplate his life, take calls from his mom, ponders his latest insights from therapy, mull a change in career direction... and leading him to wonder just what kind of life he's living, and if it's really much of a life to begin with.",2019-07-30,609.0,English,USA,assets/thumbnails/3PejXWtS4xs.webp
3Qj3s1vnyMQ,https://www.youtube.com/watch?v=3Qj3s1vnyMQ,ONE DAY NOTICE,A Hollywood agent threatens to kill an assistant if he fails to sign a famous star.,"Hunter Shea is a timid agent's assistant working for the legendary Ruth Katzman, a former Hollywood heavyweight now on the decline. But now Hunter has a possible new job, and now has to put in his notice.
The problem? He's cowed by Ruth's forceful personality, and has procrastinated on telling her he's leaving. But when he finally officially quits, he triggers a psychotic break in Ruth, who sets him a near-impossible task -- as well as the ultimate high stakes -- before he can truly leave.",2021-02-23,1347.0,English,USA,assets/thumbnails/3Qj3s1vnyMQ.webp
3Xi70uZ0JfM,https://www.youtube.com/watch?v=3Xi70uZ0JfM,HANNAHS,A woman cons her way into another woman's apartment.,"Hannah comes home to her apartment building one day to discover a woman waiting in front of it. The woman says she's waiting for one of Hannah's neighbors -- Becky Sharp, she says -- who has invited her over but seems to be flaking out on her. Hannah is polite but wary and leaves the stranger outside to wait.
But when the stranger's friend fails to show, leaving her waiting outside, Hannah invites her into her home and charge her phone. The stranger reveals her name is Hannah as well, as makes herself at home in the apartment, often to the other Hannah's discomfort. The result is a strange oddly encounter between two women that fills the need for connection for both of them, albeit in an uneasy way.",2021-06-01,847.0,English,USA,assets/thumbnails/3Xi70uZ0JfM.webp
3dVNYkSdesI,https://www.youtube.com/watch?v=3dVNYkSdesI,THIS PERFECT DAY,A rebellious teen walks into a music store. And it may change their life forever.,"Jules is a wayward youth, sitting in a car, working up the nerve to enter into a music store they've had their eye on, to do something they've been planning for a long, long time.
After a kiss from their significant other, Hannah, they steels themselves up to go inside the shop. But once inside, Jules still can't shake their nerves. In fact, Jules becomes even tenser under the sharp eye of the store proprietor -- which makes what they're about to do that much harder.",2020-06-05,436.0,English,USA,assets/thumbnails/3dVNYkSdesI.webp
3qJt8DNRvMY,https://www.youtube.com/watch?v=3qJt8DNRvMY,OUTSIDERS,An immigrant couple with expired visas faces a dilemma when their baby has an accident.,"Dmitry is a young immigrant father coming home with a crib for his infant daughter Dasha, lugging the furniture up the stairs to the cramped apartment he shares with his wife, Zhenya. All seems well until the crib breaks later that night, and the baby ends up with a bump on its head.
Zhenya wants to bring Dasha to the emergency room. But things are complicated because while Dasha was born in the U.S., Dmitry and Zhenya are immigrants whose visas have expired. They fear deportation and being separated as a family, but the safety of their baby daughter is also at stake.",2023-03-05,684.0,English,USA,assets/thumbnails/3qJt8DNRvMY.webp
3s2xNFTP50w,https://www.youtube.com/watch?v=3s2xNFTP50w,UPROOT,A woman tries to get her brother to move out. He has an extreme fear of going outside.,"Nina is on her way to see her brother, Greg, whom she hasn't seen in a long time. Living in their deceased father's house, Greg is somewhat troubled, and the house is now in foreclosure. But Greg is an agoraphobe and has refused to move before the bank repossesses the home, and Nina's task is to help her brother along.
Nina finds the place a mess, overrun with plants. And Greg is a mess as well, unkempt and despairing. He's fearful of the outside world, putting more care into his plants than himself. But for Nina to help her brother move forward, she must confront where she has been stuck with her family.",2023-09-20,588.0,English,USA,assets/thumbnails/3s2xNFTP50w.webp
3vWycT9i4qs,https://www.youtube.com/watch?v=3vWycT9i4qs,A BAND OF THIEVES,A young girl turns her Texas suburb into a lawless playground.,"Josie is a sharp-shooting young teen obsessed with Westerns. But while trying to perform a trick, she shoots her brother with an arrow and gets into trouble.
With nowhere else to turn except for her neighborhood friend Ryan, who has a crush on her, she uses her fascination with the Wild West and its legendary outlaws to devise a plan to get money. But putting these plans into action turns Josie into a criminal, until she's hunted down like the animal she's become.",2020-04-30,869.0,English,USA,assets/thumbnails/3vWycT9i4qs.webp
4-YprEKxBgM,https://www.youtube.com/watch?v=4-YprEKxBgM,DUSSELDORF,A couple argues in a parking lot. Then a bystander steps in to mediate.,"Sonya and Michael have been a couple, both romantically and creatively, since their days as art students at an obscure art school in Germany. Now frustrated creative artists, their partnership has been fraying recently, with both people in the relationship dealing with personal crises, and their reckoning comes to a fever pitch at a random parking lot in California.
Being the land of self-help, a bystander named Jules steps in to mediate between the pair. But the mediation serves to dredge up a lot more than romantic discontent, both for the couple and their drive-by couples therapist.",2023-02-06,581.0,English,USA,assets/thumbnails/4-YprEKxBgM.webp
4-pvhg_wy8A,https://www.youtube.com/watch?v=4-pvhg_wy8A,BARRIER,Two soldiers discover a young boy washed up on a beach.,"On one September night in 1944, two Canadian soldiers named Louis and Sylvain are patrolling the shore of a Dutch beach. But their patrol is interrupted when they discover a young boy washed up on the beach. He doesn't speak their language, and they have no idea where he is from or if he can be trusted during such perilous times.
As they draw their weapons, they debate over the boy's fate. Is he a spy that needs to be dealt with? Or is he just an innocent person caught up in the cross-hairs of geopolitical conflict? Their questions about the boy's fundamental innocence aren't just rhetorical: they hold the life and fate of the boy -- and maybe even the war itself -- in the balance.",2023-07-06,537.0,English,USA,assets/thumbnails/4-pvhg_wy8A.webp
